dgx_vllm_launcher/tuned_configs/nemotron3_nano_omni/headdim=64,dstate=128,device_name=NVIDIA_GB10,cache_dtype=float32.json
{
    "triton_version": "3.6.0",
    "64": {
        "BLOCK_SIZE_M": 8,
        "num_warps": 8
    },
    "128": {
        "BLOCK_SIZE_M": 16,
        "num_warps": 8
    },
    "192": {
        "BLOCK_SIZE_M": 16,
        "num_warps": 8
    },
    "256": {
        "BLOCK_SIZE_M": 32,
        "num_warps": 8
    },
    "320": {
        "BLOCK_SIZE_M": 32,
        "num_warps": 8
    },
    "384": {
        "BLOCK_SIZE_M": 32,
        "num_warps": 8
    },
    "448": {
        "BLOCK_SIZE_M": 32,
        "num_warps": 8
    },
    "512": {
        "BLOCK_SIZE_M": 32,
        "num_warps": 8
    }
}
